{
  "$schema": "https://json-schema.org/draft/2020-12/schema",
  "title": "Agent Behavior Target Registry",
  "type": "object",
  "additionalProperties": false,
  "required": [
    "registry_id",
    "version",
    "updated_at",
    "targets"
  ],
  "properties": {
    "registry_id": {
      "type": "string",
      "const": "target_registry"
    },
    "version": {
      "type": "string",
      "minLength": 1
    },
    "updated_at": {
      "type": "string",
      "pattern": "^\\d{4}-\\d{2}-\\d{2}T\\d{2}:\\d{2}:\\d{2}Z$"
    },
    "targets": {
      "type": "array",
      "minItems": 1,
      "items": {
        "type": "object",
        "additionalProperties": false,
        "required": [
          "target_profile",
          "display_name",
          "target_kind",
          "profile_path",
          "prompt_path",
          "quality_gate_profile",
          "manual_output_allowed",
          "adapter_output_allowed",
          "notes"
        ],
        "properties": {
          "target_profile": {
            "type": "string",
            "minLength": 1
          },
          "display_name": {
            "type": "string",
            "minLength": 1
          },
          "target_kind": {
            "type": "string",
            "enum": [
              "mock_profile",
              "adapter_candidate",
              "saved_transcript_target"
            ]
          },
          "profile_path": {
            "type": "string",
            "minLength": 1
          },
          "prompt_path": {
            "type": "string",
            "minLength": 1
          },
          "quality_gate_profile": {
            "type": "boolean"
          },
          "manual_output_allowed": {
            "type": "boolean"
          },
          "adapter_output_allowed": {
            "type": "boolean"
          },
          "notes": {
            "type": "string"
          }
        }
      }
    }
  }
}
